{
  "$schema": "https://json-schema.org/draft/2020-12/schema",
  "$id": "https://github.com/joshualikaist/Babdoduk/schemas/kaist-menu-week.schema.json",
  "title": "The current cafeteria week: data/kaist-menu/week.json",
  "description": "Written by scripts/refresh_kaist_menu.py, read by ggongbab.html#menu to know which dates have a file. It holds no menus. validate_content.py adds that the seven days are Monday to Sunday of weekStart and agree with the dated files.",
  "type": "object",
  "required": ["weekStart", "weekEnd", "generatedAt", "timezone", "days"],
  "additionalProperties": false,
  "properties": {
    "schemaVersion": {"type": "integer", "const": 1},
    "weekStart": {"type": "string", "pattern": "^\\d{4}-\\d{2}-\\d{2}$"},
    "weekEnd": {"type": "string", "pattern": "^\\d{4}-\\d{2}-\\d{2}$"},
    "generatedAt": {"type": "string", "pattern": "^\\d{4}-\\d{2}-\\d{2}T\\d{2}:\\d{2}:\\d{2}\\+09:00$"},
    "timezone": {"const": "Asia/Seoul"},
    "days": {
      "type": "array",
      "minItems": 7,
      "maxItems": 7,
      "items": {
        "type": "object",
        "required": ["date", "available", "restaurantCount", "status", "fetchedAt"],
        "additionalProperties": false,
        "properties": {
          "date": {"type": "string", "pattern": "^\\d{4}-\\d{2}-\\d{2}$"},
          "available": {"type": "boolean"},
          "restaurantCount": {"type": "integer", "minimum": 0},
          "status": {"enum": ["AVAILABLE", "NOT_PUBLISHED_YET", "FETCH_FAILED", "STALE_SAVED_DATA"]},
          "fetchedAt": {"type": ["string", "null"], "pattern": "^\\d{4}-\\d{2}-\\d{2}T\\d{2}:\\d{2}:\\d{2}(\\.\\d+)?\\+09:00$"}
        }
      }
    }
  }
}
