{
  "schemaVersion": 1,
  "weekStart": "2026-10-19",
  "weekEnd": "2026-10-25",
  "generatedAt": "2026-10-24T14:51:13+09:00",
  "timezone": "Asia/Seoul",
  "days": [
    {
      "date": "2026-10-19",
      "available": true,
      "restaurantCount": 8,
      "status": "AVAILABLE",
      "fetchedAt": "2026-10-19T18:01:29+09:00"
    },
    {
      "date": "2026-10-20",
      "available": true,
      "restaurantCount": 8,
      "status": "AVAILABLE",
      "fetchedAt": "2026-10-20T17:39:29+09:00"
    },
    {
      "date": "2026-10-21",
      "available": true,
      "restaurantCount": 8,
      "status": "AVAILABLE",
      "fetchedAt": "2026-10-21T21:55:23+09:00"
    },
    {
      "date": "2026-10-22",
      "available": true,
      "restaurantCount": 8,
      "status": "AVAILABLE",
      "fetchedAt": "2026-10-22T15:09:53+09:00"
    },
    {
      "date": "2026-10-23",
      "available": true,
      "restaurantCount": 8,
      "status": "AVAILABLE",
      "fetchedAt": "2026-10-23T15:09:26+09:00"
    },
    {
      "date": "2026-10-24",
      "available": true,
      "restaurantCount": 4,
      "status": "AVAILABLE",
      "fetchedAt": "2026-10-24T14:51:13+09:00"
    },
    {
      "date": "2026-10-25",
      "available": true,
      "restaurantCount": 5,
      "status": "AVAILABLE",
      "fetchedAt": "2026-10-24T14:51:13+09:00"
    }
  ]
}
